{
  "id": "sydtekuniversity-sol",
  "sns_name": "sydtekuniversity.sol",
  "display_name": "SydTek University",
  "role": "institutional_node",
  "state": "linked_repo",
  "description": "Institutional authority identity for SydTek University within the GCB ecosystem.",
  "wallet": {
    "chain": "solana",
    "address": "REPLACE_WITH_WALLET",
    "custody_model": "organizational_controlled",
    "multisig": true
  },
  "governance": {
    "role_class": "institutional_node",
    "voting_weight": 0.9,
    "permissions": [
      "institutional_reference",
      "program_alignment",
      "governance_participation"
    ]
  },
  "agent": {
    "type": "institutional_agent",
    "status": "planned",
    "capabilities": [
      "institutional_resolution",
      "program_registry_reference",
      "official_alignment"
    ],
    "endpoint": ""
  },
  "repos": [
    {
      "name": "gcb-knowledge-infrastructure",
      "relationship": "linked_repo",
      "path": "education/sydtek-university"
    }
  ],
  "web": {
    "primary_site": "https://REPLACE_WITH_SITE",
    "secondary_sites": []
  },
  "tee": {
    "enabled": false,
    "attestation_status": "not_required_yet",
    "attestation_file": "",
    "notes": "Can later evolve into a credentialing or institutional automation layer."
  },
  "metadata": {
    "created_at": "2026-04-22T00:00:00Z",
    "updated_at": "2026-04-22T00:00:00Z",
    "maintainer": "Dr. Justin Goldston"
  }
}