{
  "id": "elisegoldston-sol",
  "sns_name": "elisegoldston.sol",
  "display_name": "Elise",
  "role": "legacy_node",
  "state": "registry_only",
  "description": "Legacy and family identity node within the GCB named intelligence system.",
  "wallet": {
    "chain": "solana",
    "address": "REPLACE_WITH_WALLET",
    "custody_model": "family_controlled",
    "multisig": false
  },
  "governance": {
    "role_class": "legacy_node",
    "voting_weight": 0.3,
    "permissions": [
      "identity_presence",
      "legacy_mapping"
    ]
  },
  "agent": {
    "type": "legacy_identity",
    "status": "registry_only",
    "capabilities": [
      "identity_anchor",
      "future_legacy_extension"
    ],
    "endpoint": ""
  },
  "repos": [],
  "web": {
    "primary_site": "",
    "secondary_sites": []
  },
  "tee": {
    "enabled": false,
    "attestation_status": "not_applicable",
    "attestation_file": "",
    "notes": "Registry-only identity unless future dedicated logic is created."
  },
  "metadata": {
    "created_at": "2026-04-22T00:00:00Z",
    "updated_at": "2026-04-22T00:00:00Z",
    "maintainer": "Dr. Justin Goldston"
  }
}